{
  "$schema": "http://json-schema.org/draft-07/schema#",
  "title": "rvoptkb-extract Input",
  "description": "Input JSON format for the rvoptkb-extract skill. Generated by fetch-github.py or fetch-github.sh from a GitHub commit URL.",
  "type": "object",
  "required": ["patch_subject", "commit_message", "code_diff", "output_path"],
  "properties": {
    "patch_subject": {
      "type": "string",
      "description": "First line of the commit message (subject line / title)",
      "examples": ["cpu: rv64: gemm: improve gemm kernel performance by tuning LMUL"]
    },
    "commit_message": {
      "type": "string",
      "description": "Full commit message (subject line + body)",
      "examples": ["cpu: rv64: gemm: improve gemm kernel performance by tuning LMUL\n\nAdjust LMUL parameters..."]
    },
    "code_diff": {
      "type": "string",
      "description": "Complete unified diff/patch content from the commit (all files concatenated)",
      "examples": ["@@ -40,19 +40,21 @@ using gemm_f32_traits..."]
    },
    "output_path": {
      "type": "string",
      "description": "Absolute or relative path where output JSON should be written. Generated by fetch script as {repo}_{fullSHA}_output.json.",
      "examples": ["/path/to/oneDNN_bd984d09dc5985a19fb427ac46d19d2cbd5558dd_output.json"]
    }
  }
}