{
  "patch_subject": "cpu: rv64: gemm: improve gemm kernel performance by tuning LMUL",
  "commit_message": "cpu: rv64: gemm: improve gemm kernel performance by tuning LMUL",
  "code_diff": "diff --git a/src/cpu/rv64/gemm/rvv_gemm_f32.cpp b/src/cpu/rv64/gemm/rvv_gemm_f32.cpp\n@@ -40,19 +40,21 @@ using gemm_f32_traits = gemm_utils::gemm_utils_traits<float>;\n \n namespace {\n \n-#define STORE_C(C_PTR, V_C_REG, ALPHA, BETA, VL) \\\n+#define STORE_C(C_PTR, V_C_REG, ALPHA, BETA, VL, LMUL) \\\n     do { \\\n         float *c_final_ptr = (C_PTR); \\\n         if ((BETA) == 0.0f) { \\\n-            vfloat32m1_t v_res \\\n-                    = __riscv_vfmul_vf_f32m1((V_C_REG), (ALPHA), (VL)); \\\n-            __riscv_vse32_v_f32m1(c_final_ptr, v_res, (VL)); \\\n+            vfloat32##LMUL##_t v_res \\\n+                    = __riscv_vfmul_vf_f32##LMUL((V_C_REG), (ALPHA), (VL)); \\\n+            __riscv_vse32_v_f32##LMUL(c_final_ptr, v_res, (VL)); \\\n         } else { \\\n-            vfloat32m1_t v_c_old = __riscv_vle32_v_f32m1(c_final_ptr, (VL)); \\\n-            vfloat32m1_t v_res \\\n-                    = __riscv_vfmul_vf_f32m1(v_c_old, (BETA), (VL)); \\\n-            v_res = __riscv_vfmacc_vf_f32m1(v_res, (ALPHA), (V_C_REG), (VL)); \\\n-            __riscv_vse32_v_f32m1(c_final_ptr, v_res, (VL)); \\\n+            vfloat32##LMUL##_t v_c_old \\\n+                    = __riscv_vle32_v_f32##LMUL(c_final_ptr, (VL)); \\\n+            vfloat32##LMUL##_t v_res \\\n+                    = __riscv_vfmul_vf_f32##LMUL(v_c_old, (BETA), (VL)); \\\n+            v_res = __riscv_vfmacc_vf_f32##LMUL( \\\n+                    v_res, (ALPHA), (V_C_REG), (VL)); \\\n+            __riscv_vse32_v_f32##LMUL(c_final_ptr, v_res, (VL)); \\\n         } \\\n     } while (0)",
  "output_path": "/tmp/rvoptkb-test/oneDNN_bd984d09dc5985a19fb427ac46d19d2cbd5558dd_output.json"
}